{"codex":{"approval_policy":"on-request+auto-review","executable_sha256":"539d351a0f87d4186673a3bd65a480b2e87ebeb7324045019a2d23729770c092","network":"CONTROLLED","sandbox":"permission-profile:workspace-only; windows-elevated","version":"codex-cli 0.148.0-alpha.15"},"current_run":null,"exit_status":0,"guardrails":{"max_programmes":null,"max_retries":2,"runtime_budget_seconds":null,"until_programme":null},"last_accepted_freeze":null,"orchestrator_state":"STOPPED","real_research_loop_started":false,"retry_count":0,"schema_version":"1.0.0","stop_reason":"NONE","updated_at":"2026-08-21T09:10:20Z","validation_result":"PASS"}
